{"$schema":"https://json-schema.org/draft/2020-12/schema","$id":"tw_verified_security_master_snapshot.v1.schema.json","title":"TW Verified Security Master Snapshot v1","type":"object","required":["schema_version","snapshot_id","generated_at_utc","effective_observation_date","source_skill","coverage","records","quarantined_lifecycle_events"],"additionalProperties":false,"properties":{"schema_version":{"const":"tw_verified_security_master_snapshot.v1"},"snapshot_id":{"type":"string","minLength":1},"generated_at_utc":{"type":"string","format":"date-time"},"effective_observation_date":{"type":"string","format":"date"},"source_skill":{"type":"object","required":["name","skill_version","skill_path","skill_contract_hash"],"additionalProperties":false,"properties":{"name":{"const":"tw-security-master-classifier"},"skill_version":{"type":"string","minLength":1},"skill_path":{"const":"skills/tw-security-master-classifier"},"skill_contract_hash":{"type":"string","pattern":"^[0-9a-f]{64}$"}}},"coverage":{"type":"object","required":["markets","instrument_types","record_count","lifecycle_event_count","coverage_status","total_lifecycle_event_count"],"additionalProperties":true,"properties":{"markets":{"type":"array","items":{"type":"string"}},"instrument_types":{"type":"array","items":{"type":"string"}},"record_count":{"type":"integer","minimum":0},"lifecycle_event_count":{"type":"integer","minimum":0},"coverage_status":{"type":"string","minLength":1},"quarantined_lifecycle_event_count":{"type":"integer","minimum":0},"total_lifecycle_event_count":{"type":"integer","minimum":0}}},"quarantined_lifecycle_events":{"type":"array","items":{"type":"object"}},"records":{"type":"array","items":{"type":"object","required":["record_id","canonical_target_id","identity","classification","observation","lifecycle","execution_eligibility","evidence_summary","conflicts","caveats","record_hash"],"additionalProperties":false,"properties":{"record_id":{"type":"string","minLength":1},"canonical_target_id":{"type":"string","pattern":"^(TWSE|TPEX):[A-Z0-9._-]{1,20}$"},"identity":{"type":"object","required":["security_code","security_name_zh","security_name_en","isin","cfi"],"additionalProperties":false,"properties":{"security_code":{"type":["string","null"]},"security_name_zh":{"type":["string","null"]},"security_name_en":{"type":["string","null"]},"isin":{"type":["string","null"]},"cfi":{"type":["string","null"]}}},"classification":{"type":"object","required":["asset_class","instrument_family","instrument_type","market","board","listed_common_stock_core_flag","classification_status","reason_codes","conflicts"],"additionalProperties":true,"properties":{"market":{"type":"string"},"instrument_type":{"type":"string"},"classification_status":{"enum":["confirmed_dual_lane","confirmed_official_single_lane","provisional_single_lane","quarantine_conflict","quarantine_unknown"]},"listed_common_stock_core_flag":{"type":"boolean"},"reason_codes":{"type":"array","items":{"type":"string"}},"conflicts":{"type":"array"}}},"observation":{"type":"object","required":["status","observed_at","source_updated_date"],"additionalProperties":false,"properties":{"status":{"enum":["observed_in_capture","observed_in_latest_verified_snapshot","fixture_observation_only","historical_capture"]},"observed_at":{"type":["string","null"],"format":"date-time"},"source_updated_date":{"type":["string","null"],"format":"date"}}},"lifecycle":{"type":"object","required":["state","resolution_status","as_of","basis_event_ids","events"],"additionalProperties":false,"properties":{"state":{"type":"string"},"resolution_status":{"enum":["resolved","partial","unavailable","conflicted"]},"as_of":{"type":"string","format":"date"},"basis_event_ids":{"type":"array","items":{"type":"string"}},"events":{"type":"array","items":{"type":"object"}}}},"execution_eligibility":{"type":"object","required":["status","reason_codes"],"additionalProperties":false,"properties":{"status":{"enum":["allowed","allowed_with_caveat","blocked"]},"reason_codes":{"type":"array","items":{"type":"string"}}}},"evidence_summary":{"type":"object"},"conflicts":{"type":"array"},"caveats":{"type":"array","items":{"type":"string"}},"record_hash":{"type":"string","pattern":"^[0-9a-f]{64}$"}}}}}}
