{
  "coverage": {
    "coverage_status": "complete",
    "instrument_types": [
      "equity",
      "etf"
    ],
    "lifecycle_event_count": 0,
    "markets": [
      "twse",
      "tpex"
    ],
    "quarantined_lifecycle_event_count": 0,
    "record_count": 9,
    "total_lifecycle_event_count": 0
  },
  "effective_observation_date": "2026-07-16",
  "generated_at_utc": "2026-07-16T03:00:00Z",
  "quarantined_lifecycle_events": [],
  "records": [
    {
      "canonical_target_id": "TWSE:2330",
      "caveats": [],
      "classification": {
        "asset_class": "securities",
        "board": "main",
        "classification_status": "confirmed_official_single_lane",
        "conflicts": [],
        "instrument_family": "equity",
        "instrument_type": "equity",
        "listed_common_stock_core_flag": true,
        "market": "TWSE",
        "reason_codes": []
      },
      "conflicts": [],
      "evidence_summary": {},
      "execution_eligibility": {
        "reason_codes": [],
        "status": "allowed"
      },
      "identity": {
        "cfi": "ESVUFR",
        "isin": "TW000233000",
        "security_code": "2330",
        "security_name_en": "EnglishName 2330",
        "security_name_zh": "台積電-seed-r5a"
      },
      "lifecycle": {
        "as_of": "2026-07-16",
        "basis_event_ids": [],
        "events": [],
        "resolution_status": "resolved",
        "state": "active"
      },
      "observation": {
        "observed_at": "2026-07-16T03:00:00Z",
        "source_updated_date": "2026-07-16",
        "status": "observed_in_capture"
      },
      "record_hash": "132f0af72c68f5c15562e7fb0cdb4d3ed75894377c8b7bec6c778c4a9c162d65",
      "record_id": "rec-01"
    },
    {
      "canonical_target_id": "TWSE:2317",
      "caveats": [],
      "classification": {
        "asset_class": "securities",
        "board": "main",
        "classification_status": "confirmed_official_single_lane",
        "conflicts": [],
        "instrument_family": "equity",
        "instrument_type": "equity",
        "listed_common_stock_core_flag": true,
        "market": "TWSE",
        "reason_codes": []
      },
      "conflicts": [],
      "evidence_summary": {},
      "execution_eligibility": {
        "reason_codes": [],
        "status": "allowed"
      },
      "identity": {
        "cfi": "ESVUFR",
        "isin": "TW000231700",
        "security_code": "2317",
        "security_name_en": "EnglishName 2317",
        "security_name_zh": "鴻海-seed-r5a"
      },
      "lifecycle": {
        "as_of": "2026-07-16",
        "basis_event_ids": [],
        "events": [],
        "resolution_status": "resolved",
        "state": "active"
      },
      "observation": {
        "observed_at": "2026-07-16T03:00:00Z",
        "source_updated_date": "2026-07-16",
        "status": "observed_in_capture"
      },
      "record_hash": "644dea8b8b6022106162f315fcbb06306f8cb82eac45ded4ac64deb079ce5a21",
      "record_id": "rec-02"
    },
    {
      "canonical_target_id": "TPEX:6488",
      "caveats": [],
      "classification": {
        "asset_class": "securities",
        "board": "main",
        "classification_status": "confirmed_official_single_lane",
        "conflicts": [],
        "instrument_family": "equity",
        "instrument_type": "equity",
        "listed_common_stock_core_flag": true,
        "market": "TPEX",
        "reason_codes": []
      },
      "conflicts": [],
      "evidence_summary": {},
      "execution_eligibility": {
        "reason_codes": [],
        "status": "allowed"
      },
      "identity": {
        "cfi": "ESVUFR",
        "isin": "TW000648800",
        "security_code": "6488",
        "security_name_en": "EnglishName 6488",
        "security_name_zh": "環球晶-seed-r5a"
      },
      "lifecycle": {
        "as_of": "2026-07-16",
        "basis_event_ids": [],
        "events": [],
        "resolution_status": "resolved",
        "state": "active"
      },
      "observation": {
        "observed_at": "2026-07-16T03:00:00Z",
        "source_updated_date": "2026-07-16",
        "status": "observed_in_capture"
      },
      "record_hash": "1979e7f5f44b9a8866cad2bf8ddab1bed75ad79684e7eda7fed92e1e43f26ac5",
      "record_id": "rec-03"
    },
    {
      "canonical_target_id": "TWSE:0050",
      "caveats": [],
      "classification": {
        "asset_class": "securities",
        "board": "main",
        "classification_status": "confirmed_official_single_lane",
        "conflicts": [],
        "instrument_family": "structured_product",
        "instrument_type": "etf",
        "listed_common_stock_core_flag": false,
        "market": "TWSE",
        "reason_codes": []
      },
      "conflicts": [],
      "evidence_summary": {},
      "execution_eligibility": {
        "reason_codes": [],
        "status": "allowed"
      },
      "identity": {
        "cfi": "CEJVXX",
        "isin": "TW000005000",
        "security_code": "0050",
        "security_name_en": "EnglishName 0050",
        "security_name_zh": "元大台灣50-seed-r5a"
      },
      "lifecycle": {
        "as_of": "2026-07-16",
        "basis_event_ids": [],
        "events": [],
        "resolution_status": "resolved",
        "state": "active"
      },
      "observation": {
        "observed_at": "2026-07-16T03:00:00Z",
        "source_updated_date": "2026-07-16",
        "status": "observed_in_capture"
      },
      "record_hash": "b4a4574629a6ae38c26cee835b53f08f080cfdda8ed350f73ba9ac69346b1240",
      "record_id": "rec-04"
    },
    {
      "canonical_target_id": "TPEX:5347",
      "caveats": [],
      "classification": {
        "asset_class": "securities",
        "board": "main",
        "classification_status": "confirmed_official_single_lane",
        "conflicts": [],
        "instrument_family": "equity",
        "instrument_type": "equity",
        "listed_common_stock_core_flag": true,
        "market": "TPEX",
        "reason_codes": []
      },
      "conflicts": [],
      "evidence_summary": {},
      "execution_eligibility": {
        "reason_codes": [],
        "status": "allowed"
      },
      "identity": {
        "cfi": "ESVUFR",
        "isin": "TW000534700",
        "security_code": "5347",
        "security_name_en": "EnglishName 5347",
        "security_name_zh": "世界-seed-r5a"
      },
      "lifecycle": {
        "as_of": "2026-07-16",
        "basis_event_ids": [],
        "events": [],
        "resolution_status": "resolved",
        "state": "active"
      },
      "observation": {
        "observed_at": "2026-07-16T03:00:00Z",
        "source_updated_date": "2026-07-16",
        "status": "observed_in_capture"
      },
      "record_hash": "329ba688b4982ade7df4090cbc148998ee5cd3e82834c57350b5d13069da631a",
      "record_id": "rec-05"
    },
    {
      "canonical_target_id": "TWSE:0056",
      "caveats": [],
      "classification": {
        "asset_class": "securities",
        "board": "main",
        "classification_status": "confirmed_official_single_lane",
        "conflicts": [],
        "instrument_family": "structured_product",
        "instrument_type": "etf",
        "listed_common_stock_core_flag": false,
        "market": "TWSE",
        "reason_codes": []
      },
      "conflicts": [],
      "evidence_summary": {},
      "execution_eligibility": {
        "reason_codes": [],
        "status": "allowed"
      },
      "identity": {
        "cfi": "CEJVXX",
        "isin": "TW000005600",
        "security_code": "0056",
        "security_name_en": "EnglishName 0056",
        "security_name_zh": "元大高股息-seed-r5a"
      },
      "lifecycle": {
        "as_of": "2026-07-16",
        "basis_event_ids": [],
        "events": [],
        "resolution_status": "resolved",
        "state": "active"
      },
      "observation": {
        "observed_at": "2026-07-16T03:00:00Z",
        "source_updated_date": "2026-07-16",
        "status": "observed_in_capture"
      },
      "record_hash": "343be4bf83fca859ea1c603a0376551a7c1cbf5ac832bc099235fe99bcc3b9df",
      "record_id": "rec-06"
    },
    {
      "canonical_target_id": "TWSE:2308",
      "caveats": [],
      "classification": {
        "asset_class": "securities",
        "board": "main",
        "classification_status": "confirmed_official_single_lane",
        "conflicts": [],
        "instrument_family": "equity",
        "instrument_type": "equity",
        "listed_common_stock_core_flag": true,
        "market": "TWSE",
        "reason_codes": []
      },
      "conflicts": [],
      "evidence_summary": {},
      "execution_eligibility": {
        "reason_codes": [],
        "status": "allowed"
      },
      "identity": {
        "cfi": "ESVUFR",
        "isin": "TW000230800",
        "security_code": "2308",
        "security_name_en": "EnglishName 2308",
        "security_name_zh": "台達電-seed-r5a"
      },
      "lifecycle": {
        "as_of": "2026-07-16",
        "basis_event_ids": [],
        "events": [],
        "resolution_status": "resolved",
        "state": "active"
      },
      "observation": {
        "observed_at": "2026-07-16T03:00:00Z",
        "source_updated_date": "2026-07-16",
        "status": "observed_in_capture"
      },
      "record_hash": "bc3bacf538acdb5e0823af391e4be2fa1eea345b0d8ab71bd799b241f4876247",
      "record_id": "rec-07"
    },
    {
      "canonical_target_id": "TWSE:2382",
      "caveats": [],
      "classification": {
        "asset_class": "securities",
        "board": "main",
        "classification_status": "confirmed_official_single_lane",
        "conflicts": [],
        "instrument_family": "equity",
        "instrument_type": "equity",
        "listed_common_stock_core_flag": true,
        "market": "TWSE",
        "reason_codes": []
      },
      "conflicts": [],
      "evidence_summary": {},
      "execution_eligibility": {
        "reason_codes": [],
        "status": "allowed"
      },
      "identity": {
        "cfi": "ESVUFR",
        "isin": "TW000238200",